{
  "schema": "awr.rec.mcap_channels.v1",
  "profile": "awr",
  "doc": "MCAP channel and schema registry (AWR-16 §13.3). Topics are '/' + WS topic key; block channels are recording-only. Every awr-raw / awr-msgpack message starts with awr.rec.RecPrefix8.v1.",
  "writer": {
    "compression": "ZSTD",
    "index_types": "ALL",
    "use_chunking": true,
    "chunk_size": 4194304,
    "use_statistics": true,
    "use_summary_offsets": true,
    "enable_crcs": true,
    "repeat_channels": true,
    "repeat_schemas": true,
    "flush_wall_s": 1
  },
  "schemas": [
    {
      "name": "awr.SwarmLite32Block.v1",
      "encoding": "awr-layout",
      "data": "rt/layouts.json"
    },
    {
      "name": "awr.DroneState64.v1",
      "encoding": "awr-layout",
      "data": "rt/layouts.json"
    },
    {
      "name": "awr.SensorPose48.v1",
      "encoding": "awr-layout",
      "data": "rt/layouts.json"
    },
    {
      "name": "awr.env.keyframe.v1",
      "encoding": "jsonschema",
      "data": "env/env_state.schema.json"
    },
    {
      "name": "awr.event.v1",
      "encoding": "jsonschema",
      "data": "bus/event.schema.json"
    },
    {
      "name": "awr.StateExtBlock.v1",
      "encoding": "jsonschema",
      "data": "rec/blocks.schema.json#/$defs/stateExtBlock"
    },
    {
      "name": "awr.SafetyBlock.v1",
      "encoding": "jsonschema",
      "data": "rec/blocks.schema.json#/$defs/safetyBlock"
    },
    {
      "name": "awr.clock.v1",
      "encoding": "jsonschema",
      "data": "bus/command.schema.json#/$defs/clockReply"
    },
    {
      "name": "awr.roster.v1",
      "encoding": "jsonschema",
      "data": "bus/roster.schema.json"
    },
    {
      "name": "awr.mission.status.v1",
      "encoding": "jsonschema",
      "data": "rt/payloads/mission_status.schema.json"
    },
    {
      "name": "awr.agent.v1",
      "encoding": "jsonschema",
      "data": "agent/agent_tasks.schema.json"
    }
  ],
  "channels": [
    {
      "topic": "/swarm/uav/state_block",
      "schema": "awr.SwarmLite32Block.v1",
      "message_encoding": "awr-raw",
      "record_policy": "producer tick, default 25 Hz sim time",
      "backfill": "latest",
      "group": "state"
    },
    {
      "topic": "/uav/{id}/state",
      "schema": "awr.DroneState64.v1",
      "message_encoding": "awr-raw",
      "record_policy": "marked vehicles (<= 16) at 125 Hz; all vehicles when N <= 50",
      "backfill": "latest",
      "group": "state"
    },
    {
      "topic": "/uav/{id}/sensor/{name}/pose",
      "schema": "awr.SensorPose48.v1",
      "message_encoding": "awr-raw",
      "record_policy": "marked vehicles, native 10 Hz",
      "backfill": "latest",
      "group": "state"
    },
    {
      "topic": "/swarm/uav/state_ext_block",
      "schema": "awr.StateExtBlock.v1",
      "message_encoding": "awr-msgpack",
      "record_policy": "2 Hz delta + keyframe block every 5 s sim time",
      "backfill": "keyframe+delta",
      "group": "state"
    },
    {
      "topic": "/swarm/uav/safety_block",
      "schema": "awr.SafetyBlock.v1",
      "message_encoding": "awr-msgpack",
      "record_policy": "5 Hz delta + keyframe block every 5 s sim time",
      "backfill": "keyframe+delta",
      "group": "state"
    },
    {
      "topic": "/env/state",
      "schema": "awr.env.keyframe.v1",
      "message_encoding": "awr-msgpack",
      "record_policy": "every reliable change + 1 Hz self-contained heartbeat",
      "backfill": "latest",
      "group": "env"
    },
    {
      "topic": "/event",
      "schema": "awr.event.v1",
      "message_encoding": "awr-msgpack",
      "record_policy": "all events, one per message",
      "backfill": "none",
      "group": "event"
    },
    {
      "topic": "/sim/clock",
      "schema": "awr.clock.v1",
      "message_encoding": "awr-msgpack",
      "record_policy": "on change (play, pause, speed, step)",
      "backfill": "latest",
      "group": "clock"
    },
    {
      "topic": "/sim/roster",
      "schema": "awr.roster.v1",
      "message_encoding": "awr-msgpack",
      "record_policy": "full roster at segment start and on every change",
      "backfill": "latest",
      "group": "roster"
    },
    {
      "topic": "/mission/{mid}/status",
      "schema": "awr.mission.status.v1",
      "message_encoding": "awr-msgpack",
      "record_policy": "on change",
      "backfill": "latest",
      "group": "mission"
    },
    {
      "topic": "/agent/**",
      "schema": "awr.agent.v1",
      "message_encoding": "awr-msgpack",
      "record_policy": "all (D1-ext S3)",
      "backfill": "latest",
      "group": "agent"
    }
  ],
  "metadata": [
    "awr.binding",
    "awr.lineage",
    "awr.segment_end",
    "awr.marks"
  ],
  "d3_channels": [
    {
      "topic": "/uav/{id}/obs/nav",
      "schema": "bench/obs.v1#NavSolution",
      "message_encoding": "msgpack",
      "file": "raw",
      "rate": "10 Hz",
      "layer": "observation",
      "rrd_entity": "/fleet/<uav>"
    },
    {
      "topic": "/uav/{id}/obs/detections",
      "schema": "bench/obs.v1#Detection[]",
      "message_encoding": "json",
      "file": "raw",
      "rate": "sensor rate",
      "layer": "observation",
      "rrd_entity": "/fleet/<uav>/cam<k>/image/det"
    },
    {
      "topic": "/uav/{id}/camera/{name}/image",
      "schema": "foxglove.CompressedImage",
      "message_encoding": "protobuf",
      "file": "raw",
      "rate": "sensor rate",
      "layer": "observation",
      "rrd_entity": "/fleet/<uav>/cam<k>/image/rgb"
    },
    {
      "topic": "/uav/{id}/camera/{name}/depth",
      "schema": "foxglove.RawImage",
      "message_encoding": "protobuf",
      "file": "raw",
      "rate": "sensor rate",
      "layer": "observation",
      "rrd_entity": "/fleet/<uav>/cam<k>/image/depth"
    },
    {
      "topic": "/uav/{id}/camera/{name}/calib",
      "schema": "foxglove.CameraCalibration",
      "message_encoding": "protobuf",
      "file": "raw",
      "rate": "static and on zoom change",
      "layer": "observation",
      "rrd_entity": "/fleet/<uav>/cam<k>/image"
    },
    {
      "topic": "/uav/{id}/gimbal/{name}",
      "schema": "foxglove.FrameTransform",
      "message_encoding": "protobuf",
      "file": "raw",
      "rate": "50 Hz",
      "layer": "observation",
      "rrd_entity": "/fleet/<uav>/cam<k>"
    },
    {
      "topic": "/uav/{id}/lidar/{name}",
      "schema": "awr.sensor.lidar_frame.v2",
      "message_encoding": "binary",
      "file": "raw",
      "rate": "10 Hz",
      "layer": "observation",
      "rrd_entity": "/fleet/<uav>/lidar<k>"
    },
    {
      "topic": "/uav/{id}/imu/{name}",
      "schema": "bench/obs.v1#ImuObs",
      "message_encoding": "msgpack",
      "file": "raw",
      "rate": "200 Hz",
      "layer": "observation",
      "rrd_entity": "/fleet/<uav>/telemetry/imu"
    },
    {
      "topic": "/uav/{id}/gnss/{name}",
      "schema": "bench/obs.v1#GnssObs",
      "message_encoding": "msgpack",
      "file": "raw",
      "rate": "10 Hz",
      "layer": "observation",
      "rrd_entity": "/fleet/<uav>/telemetry/gnss"
    },
    {
      "topic": "/uav/{id}/action",
      "schema": "bench/act.v1",
      "message_encoding": "json",
      "file": "raw",
      "rate": "10 Hz",
      "layer": "run",
      "rrd_entity": "/agents/<uav>/plan"
    },
    {
      "topic": "/uav/{id}/report",
      "schema": "bench/act.v1",
      "message_encoding": "json",
      "file": "raw",
      "rate": "on event",
      "layer": "run",
      "rrd_entity": null
    },
    {
      "topic": "/net/records",
      "schema": "awr.bench.net_record.v1",
      "message_encoding": "json",
      "file": "raw",
      "rate": "per delivery",
      "layer": "run",
      "rrd_entity": "/eval/metrics/comm_*"
    },
    {
      "topic": "/env",
      "schema": "awr.env.keyframe.v1",
      "message_encoding": "msgpack",
      "file": "raw",
      "rate": "keyframes and 1 Hz",
      "layer": "run",
      "rrd_entity": "/truth/env/<field>"
    },
    {
      "topic": "/run/status",
      "schema": "awr.bench.run_status.v1",
      "message_encoding": "json",
      "file": "raw",
      "rate": "1 Hz",
      "layer": "run",
      "rrd_entity": null
    },
    {
      "topic": "/uav/{id}/state",
      "schema": "awr.DroneState64.v1",
      "message_encoding": "awr-raw",
      "file": "truth",
      "rate": "50 Hz",
      "layer": "truth",
      "rrd_entity": "/truth/fleet/<uav>"
    },
    {
      "topic": "/eval/hidden/camera/{uav}/{name}",
      "schema": "awr.sensor.camera_gt.v1",
      "message_encoding": "binary",
      "file": "truth",
      "rate": "sensor rate",
      "layer": "truth",
      "rrd_entity": "/fleet/<uav>/cam<k>/image/{instance,semantic}"
    },
    {
      "topic": "/eval/hidden/lidar/{uav}/{name}",
      "schema": "awr.sensor.lidar_gt.v1",
      "message_encoding": "binary",
      "file": "truth",
      "rate": "10 Hz",
      "layer": "truth",
      "rrd_entity": "/truth/fleet/<uav>/lidar<k>"
    },
    {
      "topic": "/eval/hidden/det_map/{uav}",
      "schema": "awr.bench.det_map.v1",
      "message_encoding": "json",
      "file": "truth",
      "rate": "sensor rate",
      "layer": "truth",
      "rrd_entity": null
    },
    {
      "topic": "/eval/hidden/extrinsics/{uav}",
      "schema": "awr.bench.extrinsics.v1",
      "message_encoding": "json",
      "file": "truth",
      "rate": "frame rate",
      "layer": "truth",
      "rrd_entity": null
    },
    {
      "topic": "/event/actors",
      "schema": "awr.event.actors.v1",
      "message_encoding": "binary",
      "file": "truth",
      "rate": "10 Hz",
      "layer": "truth",
      "rrd_entity": "/truth/actors/<id>"
    },
    {
      "topic": "/event/semantic",
      "schema": "awr.event.semantic.v1",
      "message_encoding": "json",
      "file": "truth",
      "rate": "on event",
      "layer": "truth",
      "rrd_entity": "/truth/events/<id>"
    },
    {
      "topic": "/truth/phys/{uav}/pose_history",